{
    "$schema": "./backtesting_scenarios.schema.json",
    "cbc_gap_rel": 0.10,
    "cbc_strict_time_limit_sec": 3,
    "oemag_monthly_feed_in_rates": [
        {"year": 2025, "month": 7,  "tariff_cent_kwh": 5.965},
        {"year": 2025, "month": 8,  "tariff_cent_kwh": 5.9},
        {"year": 2025, "month": 9,  "tariff_cent_kwh": 7.1},
        {"year": 2025, "month": 10, "tariff_cent_kwh": 9.008},
        {"year": 2025, "month": 11, "tariff_cent_kwh": 8.7},
        {"year": 2025, "month": 12, "tariff_cent_kwh": 8.7},
        {"year": 2026, "month": 1,  "tariff_cent_kwh": 8.842},
        {"year": 2026, "month": 2,  "tariff_cent_kwh": 8.457},
        {"year": 2026, "month": 3,  "tariff_cent_kwh": 5.72},
        {"year": 2026, "month": 4,  "tariff_cent_kwh": 6.772},
        {"year": 2026, "month": 5,  "tariff_cent_kwh": 6.772},
        {"year": 2026, "month": 6,  "tariff_cent_kwh": 6.772}
    ],
    "monthly_float_reference_cent_kwh": 7.15,
    "scenarios": [
        {
            "id": "live",
            "label": "Live",
            "settings": {
                "battery_id": "default_5kwh",
                "pv_system_id": "roof_south",
                "import_tariff_id": "awattar_at",
                "export_tariff_id": "fixed_37ct",
                "house_profile_id": "example_efh"
            }
        },
        {
            "id": "battery_5kwh_dynamic",
            "label": "5 kWh, dynamische Einspeise",
            "settings": {
                "k_push_cent": 3.7,
                "feed_in_mode": "dynamic_epex",
                "pv_tilt": 25,
                "pv_azimuth": 0,
                "pv_kwp": 10,
                "battery_max_power_kw": 2.5,
                "battery_efficiency": 0.97,
                "battery_capacity_kwh": 5.0,
                "battery_min_soc": 10.0,
                "battery_max_soc": 100.0,
                "threshold_power": 0.02,
                "latitude": 48,
                "longitude": 10
            }
        },
        {
            "id": "battery_10kwh_fixed",
            "label": "10 kWh, fixe Einspeise",
            "settings": {
                "k_push_cent": 3.7,
                "feed_in_mode": "fixed",
                "pv_tilt": 25,
                "pv_azimuth": 0,
                "pv_kwp": 10,
                "battery_max_power_kw": 5.0,
                "battery_efficiency": 0.97,
                "battery_capacity_kwh": 10.0,
                "battery_min_soc": 10.0,
                "battery_max_soc": 100.0,
                "threshold_power": 0.02,
                "latitude": 48,
                "longitude": 10
            }
        },
        {
            "id": "battery_10kwh_dynamic",
            "label": "10 kWh, dynamische Einspeise",
            "settings": {
                "k_push_cent": 3.7,
                "feed_in_mode": "dynamic_epex",
                "pv_tilt": 25,
                "pv_azimuth": 0,
                "pv_kwp": 10,
                "battery_max_power_kw": 5.0,
                "battery_efficiency": 0.97,
                "battery_capacity_kwh": 10.0,
                "battery_min_soc": 10.0,
                "battery_max_soc": 100.0,
                "threshold_power": 0.02,
                "latitude": 48,
                "longitude": 10
            }
        },
        {
            "id": "entity_refs_planning",
            "label": "10 kWh + monatliche Einspeise (Entitäten-Referenzen)",
            "settings": {
                "battery_id": "upgrade_10kwh",
                "pv_system_id": "roof_south",
                "import_tariff_id": "awattar_at",
                "export_tariff_id": "monthly_sunny",
                "house_profile_id": "example_efh",
                "latitude": 48,
                "longitude": 10,
                "timezone_name": "Europe/Vienna"
            }
        }
    ]
}
